{
  "$schema": "http://json-schema.org/draft-07/schema#",
  "title": "KawaiiGPT Plugin Manifest",
  "type": "object",
  "required": [
    "id",
    "name",
    "tools"
  ],
  "properties": {
    "id": {
      "type": "string",
      "pattern": "^[a-zA-Z][a-zA-Z0-9_-]{1,63}$"
    },
    "name": {
      "type": "string",
      "minLength": 1,
      "maxLength": 80
    },
    "version": {
      "type": "string"
    },
    "runtime": {
      "type": "string",
      "enum": [
        "builtin",
        "python",
        "node"
      ]
    },
    "entry": {
      "type": [
        "string",
        "null"
      ]
    },
    "tools": {
      "type": "array",
      "items": {
        "oneOf": [
          {
            "type": "string"
          },
          {
            "type": "object",
            "required": [
              "name"
            ],
            "properties": {
              "name": {
                "type": "string"
              },
              "description": {
                "type": "string"
              },
              "parameters": {
                "type": "object"
              }
            }
          }
        ]
      }
    },
    "permissions": {
      "type": "array",
      "items": {
        "type": "string"
      }
    },
    "phrases": {
      "type": "array",
      "items": {
        "type": "string"
      }
    },
    "category": {
      "type": "string"
    },
    "summary": {
      "type": "string"
    },
    "author": {
      "type": "string"
    },
    "homepage": {
      "type": "string"
    },
    "kawaiiMinVersion": {
      "type": "string"
    },
    "panelRunnable": {
      "type": "boolean",
      "description": "If true, tools can be started from the Plugins panel (P2)"
    },
    "enabled": {
      "type": "boolean"
    }
  }
}